{
  "golden_case_version": "1.0.0",
  "case_id": "golden_08_disjunction",
  "required_index": 8,
  "title": "Bounded disjunction",
  "synthetic": true,
  "family": {
    "family_schema_version": "1.0.0",
    "family_id": "gold_fam_08",
    "pool": "staged",
    "split": "test",
    "scenario_id": "scn_golden",
    "session_ids": [
      "sess_golden"
    ],
    "capability_tags": [
      "bounded_or",
      "attribute"
    ],
    "canonical_query": "a person wearing a red or blue hat",
    "paraphrases": [
      {
        "text": "someone in a red or blue cap",
        "author_id": "gold_a1",
        "written_independently": true
      },
      {
        "text": "a person whose hat is red or blue",
        "author_id": "gold_a3",
        "written_independently": true
      }
    ],
    "scope": {
      "video_ids": [
        "sess_golden_v1"
      ],
      "camera_ids": [
        "cam_gold"
      ],
      "start_time": null,
      "end_time": null,
      "sampling_policy_version": "sampling-1.0.0"
    },
    "ground_truth": {
      "intervals": {
        "cardinality": "one",
        "intervals": [
          {
            "video_id": "sess_golden_v1",
            "camera_id": "cam_gold",
            "t0": 700.0,
            "t1": 713.0,
            "boundary": {
              "start_pts": 700.0,
              "end_pts": 713.0,
              "tolerance_s": 1.0,
              "source": "human_ledger"
            }
          }
        ]
      },
      "atoms_relations": {
        "atoms": [
          {
            "atom_id": "a1",
            "text_span": "a person",
            "type": "object",
            "required": true,
            "role": "candidate_anchor",
            "gt_state": "supported"
          },
          {
            "atom_id": "a2",
            "text_span": "red hat",
            "type": "attribute",
            "required": false,
            "visibility_sensitive": true,
            "gt_state": "contradicted"
          },
          {
            "atom_id": "a3",
            "text_span": "blue hat",
            "type": "attribute",
            "required": false,
            "visibility_sensitive": true,
            "gt_state": "supported"
          }
        ],
        "logic_groups": [
          {
            "group_id": "g1",
            "operator": "any",
            "atom_ids": [
              "a2",
              "a3"
            ],
            "observation_scope": "candidate_episode",
            "gt_outcome": "satisfied",
            "min_count": null,
            "max_count": null
          }
        ]
      },
      "track_logic": {
        "disjunction_gt": [
          {
            "group_id": "g1",
            "alternatives": [
              "red hat",
              "blue hat"
            ],
            "present_alternatives": [
              "blue hat"
            ],
            "expected_outcome": "satisfied"
          }
        ]
      }
    },
    "labels": {
      "assessability": {
        "overall": "assessable",
        "reasons": [
          "clear"
        ]
      },
      "boundary": {
        "start_pts": 700.0,
        "end_pts": 713.0,
        "tolerance_s": 1.0,
        "source": "human_ledger"
      }
    },
    "ground_truth_source": "human_ledger",
    "empty_set_review": {
      "required": false,
      "review_complete": false
    },
    "synthetic": true
  },
  "expected": {
    "archive_conclusion": "verified_matches_found",
    "headline_contains": "VERIFIED MATCH",
    "variants": [
      {
        "name": "blue_hat_present",
        "expected_outcome": "satisfied"
      },
      {
        "name": "green_hat_only",
        "expected_outcome": "not_satisfied",
        "note": "neither alternative present -> no verified match"
      }
    ]
  }
}
