{
  "golden_case_version": "1.0.0",
  "case_id": "golden_04_binding",
  "required_index": 4,
  "title": "Binding",
  "synthetic": true,
  "family": {
    "family_schema_version": "1.1.0",
    "family_id": "gold_fam_04",
    "pool": "staged",
    "split": "test",
    "scenario_id": "scn_golden",
    "session_ids": [
      "sess_golden"
    ],
    "capability_tags": [
      "binding",
      "attribute",
      "action",
      "temporal_order",
      "location"
    ],
    "canonical_query": "a person in red places a black bag near the gate and walks away",
    "paraphrases": [
      {
        "text": "a red-clothed person sets a black bag by the gate then leaves",
        "author_id": "gold_a1",
        "written_independently": true
      },
      {
        "text": "someone in red drops a black bag at the gate and departs",
        "author_id": "gold_a2",
        "written_independently": true
      }
    ],
    "scope": {
      "video_ids": [
        "sess_golden_v1"
      ],
      "camera_ids": [
        "cam_gold"
      ],
      "start_time": null,
      "end_time": null,
      "sampling_policy_version": "sampling-1.0.0"
    },
    "ground_truth": {
      "intervals": {
        "cardinality": "one",
        "intervals": [
          {
            "video_id": "sess_golden_v1",
            "camera_id": "cam_gold",
            "t0": 300.0,
            "t1": 318.0,
            "boundary": {
              "start_pts": 300.0,
              "end_pts": 318.0,
              "tolerance_s": 1.0,
              "source": "human_ledger"
            }
          }
        ]
      },
      "atoms_relations": {
        "atoms": [
          {
            "atom_id": "a1",
            "text_span": "person",
            "type": "object",
            "required": true,
            "role": "candidate_anchor",
            "gt_state": "supported"
          },
          {
            "atom_id": "a2",
            "text_span": "red",
            "type": "attribute",
            "required": true,
            "visibility_sensitive": true,
            "gt_state": "supported"
          },
          {
            "atom_id": "a3",
            "text_span": "black bag",
            "type": "object",
            "required": true,
            "visibility_sensitive": true,
            "gt_state": "supported"
          },
          {
            "atom_id": "a4",
            "text_span": "near the gate",
            "type": "location",
            "required": true,
            "role": "filter",
            "gt_state": "supported"
          },
          {
            "atom_id": "a5",
            "text_span": "places",
            "type": "action",
            "required": true,
            "gt_state": "supported"
          },
          {
            "atom_id": "a6",
            "text_span": "walks away",
            "type": "action",
            "required": true,
            "gt_state": "supported"
          }
        ],
        "relations": [
          {
            "relation_id": "r1",
            "subject_atom": "a1",
            "predicate": "places",
            "object_atom": "a3",
            "required": true,
            "gt_state": "supported"
          }
        ],
        "temporal_relations": [
          {
            "first_atom": "a5",
            "relation": "before",
            "second_atom": "a6",
            "same_actor_required": true,
            "max_gap_s": 30
          }
        ]
      }
    },
    "labels": {
      "assessability": {
        "overall": "assessable",
        "reasons": [
          "clear"
        ]
      },
      "boundary": {
        "start_pts": 300.0,
        "end_pts": 318.0,
        "tolerance_s": 1.0,
        "source": "human_ledger"
      }
    },
    "ground_truth_source": "human_ledger",
    "empty_set_review": {
      "required": false,
      "review_complete": false
    },
    "synthetic": true
  },
  "expected": {
    "archive_conclusion": "verified_matches_found",
    "headline_contains": "VERIFIED MATCH"
  }
}
